{
  "schema": "hub.qa.backend-unit-observer-receipt/v1",
  "target": "backend-unit",
  "root_handoff_sha256": "sha256:eeeeeeeeeeeeeeeeeeeeeeeeeeeeeeeeeeeeeeeeeeeeeeeeeeeeeeeeeeeeeeee",
  "concurrency_observation_scope": "docker-ps-visible-containers-only",
  "run_id": "backend-unit-20260901T120000Z-a1b2c3d4e5f6-a1b2c3d4",
  "owner_nonce": "a1b2c3d4e5f60718293a4b5c6d7e8f90",
  "container_id": "0123456789abcdef0123456789abcdef0123456789abcdef0123456789abcdef",
  "container_image": "sha256:dddddddddddddddddddddddddddddddddddddddddddddddddddddddddddddddd",
  "container_hostname": "a1b2c3d4e5f6",
  "container_receipt_sha256": "sha256:dddddddddddddddddddddddddddddddddddddddddddddddddddddddddddddddd",
  "compose_sha256": "sha256:418b8714ed1aaa3f67e4dc8aca38a6cf75a9a3a4f77288b7ac40c1ee2fdb7137",
  "git": {
    "head_before": "bbbbbbbbbbbbbbbbbbbbbbbbbbbbbbbbbbbbbbbb",
    "head_after": "bbbbbbbbbbbbbbbbbbbbbbbbbbbbbbbbbbbbbbbb",
    "status_before": "",
    "status_after": ""
  },
  "frozen_subjects": {
    "backend/internal/calls/call_durable_credential_allocation.go": "sha256:be6ff058468c4e288e0b0d7060fd17cf3118229d009f28dc056d89f281e99d4d",
    "backend/tests/calls/call_durable_credential_allocation_test.go": "sha256:0ae525c86a75369bdb5790f26b1308f42574fb545883328da24011d4150b03a9"
  },
  "source_snapshots": {
    "prebuild": {
      "head": "bbbbbbbbbbbbbbbbbbbbbbbbbbbbbbbbbbbbbbbb",
      "status": "",
      "source_root_sha256": {
        "backend/cmd": "sha256:1111111111111111111111111111111111111111111111111111111111111111",
        "backend/internal": "sha256:2222222222222222222222222222222222222222222222222222222222222222",
        "backend/tests": "sha256:3333333333333333333333333333333333333333333333333333333333333333",
        "backend/ent/schema": "sha256:4444444444444444444444444444444444444444444444444444444444444444",
        "backend/migrations": "sha256:5555555555555555555555555555555555555555555555555555555555555555",
        "backend/testframework": "sha256:6666666666666666666666666666666666666666666666666666666666666666"
      },
      "frozen_subjects": {
        "backend/internal/calls/call_durable_credential_allocation.go": "sha256:be6ff058468c4e288e0b0d7060fd17cf3118229d009f28dc056d89f281e99d4d",
        "backend/tests/calls/call_durable_credential_allocation_test.go": "sha256:0ae525c86a75369bdb5790f26b1308f42574fb545883328da24011d4150b03a9"
      },
      "canonical_build_input_manifest_sha256": "sha256:8f05f8d4fd2e503f961755e5c80a3c1acfe78ab41aa61cc6aa5d51cc9b07f83e"
    },
    "postgreen": {
      "head": "bbbbbbbbbbbbbbbbbbbbbbbbbbbbbbbbbbbbbbbb",
      "status": "",
      "source_root_sha256": {
        "backend/cmd": "sha256:1111111111111111111111111111111111111111111111111111111111111111",
        "backend/internal": "sha256:2222222222222222222222222222222222222222222222222222222222222222",
        "backend/tests": "sha256:3333333333333333333333333333333333333333333333333333333333333333",
        "backend/ent/schema": "sha256:4444444444444444444444444444444444444444444444444444444444444444",
        "backend/migrations": "sha256:5555555555555555555555555555555555555555555555555555555555555555",
        "backend/testframework": "sha256:6666666666666666666666666666666666666666666666666666666666666666"
      },
      "frozen_subjects": {
        "backend/internal/calls/call_durable_credential_allocation.go": "sha256:be6ff058468c4e288e0b0d7060fd17cf3118229d009f28dc056d89f281e99d4d",
        "backend/tests/calls/call_durable_credential_allocation_test.go": "sha256:0ae525c86a75369bdb5790f26b1308f42574fb545883328da24011d4150b03a9"
      },
      "canonical_build_input_manifest_sha256": "sha256:8f05f8d4fd2e503f961755e5c80a3c1acfe78ab41aa61cc6aa5d51cc9b07f83e"
    },
    "observer_snapshot": {
      "head": "bbbbbbbbbbbbbbbbbbbbbbbbbbbbbbbbbbbbbbbb",
      "status": "",
      "source_root_sha256": {
        "backend/cmd": "sha256:1111111111111111111111111111111111111111111111111111111111111111",
        "backend/internal": "sha256:2222222222222222222222222222222222222222222222222222222222222222",
        "backend/tests": "sha256:3333333333333333333333333333333333333333333333333333333333333333",
        "backend/ent/schema": "sha256:4444444444444444444444444444444444444444444444444444444444444444",
        "backend/migrations": "sha256:5555555555555555555555555555555555555555555555555555555555555555",
        "backend/testframework": "sha256:6666666666666666666666666666666666666666666666666666666666666666"
      },
      "frozen_subjects": {
        "backend/internal/calls/call_durable_credential_allocation.go": "sha256:be6ff058468c4e288e0b0d7060fd17cf3118229d009f28dc056d89f281e99d4d",
        "backend/tests/calls/call_durable_credential_allocation_test.go": "sha256:0ae525c86a75369bdb5790f26b1308f42574fb545883328da24011d4150b03a9"
      },
      "canonical_build_input_manifest_sha256": "sha256:8f05f8d4fd2e503f961755e5c80a3c1acfe78ab41aa61cc6aa5d51cc9b07f83e"
    }
  },
  "canonical_build_input_manifest_bytes": "docker-compose.local.yml\tsha256:418b8714ed1aaa3f67e4dc8aca38a6cf75a9a3a4f77288b7ac40c1ee2fdb7137\ntestframework/docker/Dockerfile.qa\tsha256:9a94a7520fc2db7f3c84ea29440043c682c48d9bfaf1194344e93db3fa191900\ntestframework/docker/entrypoints/backend-unit.sh\tsha256:6cac8f86e78e671036d9e581b199a141e246986cce740bc59232348c2c53642a\ntestframework/docker/backend_unit/runtime.sh\tsha256:613260fa9a505ee822d05a782561b9304ce99bcfb3d50b558bb2e0464359cd65\ntestframework/docker/backend_unit/plan.sh\tsha256:1a54187cbc727a36e21bb6978b69b545029fe4bb7e76d141a1e49c8cfea51086\ntestframework/docker/backend_unit/execute.sh\tsha256:280c819e3c08c282f8fb445410cda06b5adad62ba9c23b9afd91a8d9728a733a\ntestframework/docker/backend_unit/receipt.sh\tsha256:8c78b2e47dd7e65302a4d1775b4a48672d6eb113e1785e71cf62beae2253ce40\ntestframework/observers/__init__.py\tsha256:30cdd64d89647df0ee0ac94837859b4baf94088a16cef7f32f2d98752df30437\ntestframework/observers/backend_unit/__init__.py\tsha256:7f118c4fff9dc91f5d9399d1587f072c23ed6be31b032b54d23d2e6a72b10173\ntestframework/observers/backend_unit/contracts.py\tsha256:137f61c13a3b5a2b776945405ce37f9f63d83faa7ce2ac53daf9fb5376a7342d\ntestframework/observers/backend_unit/safe_paths.py\tsha256:59fc35f5c64c7c61c8f9a1b3f72ac468294ef800a6149dc74422cbdc1a793485\ntestframework/observers/backend_unit/lease.py\tsha256:31235c1009cdb4b258738f34c0daec3c5899dbba1af4aedafc51d99d63eb6ad8\ntestframework/observers/backend_unit/resources.py\tsha256:e5bc05e6c9adb7aaef57350a1d7b4d9e5e782d8e60b5c19227c4ce9b58180020\ntestframework/observers/backend_unit/docker_adapter.py\tsha256:c545ce61633de7b5ccc837911f6b5f0fbfc9c0fb4323e31f8e59349c42710920\ntestframework/observers/backend_unit/publication.py\tsha256:959326776cc86ec2a697cda686e41c5d113f75543408067571db0cdb5064b3fa\ntestframework/observers/backend_unit/observe.py\tsha256:565eb14d60e1aee718f273712950e69ef01438202fbe739c15b470e7b3b8e586\ntestframework/schemas/backend-unit-package-plan.schema.v1.json\tsha256:3b28a202014627a1e3180facf81233304028f927bd45c13daa0e30dd12021e37\ntestframework/schemas/backend-unit-container-receipt.schema.v1.json\tsha256:ff7ac928e39653003f102d2fc0f6bd4fa7e4e12c042ffe304829b0ccc8c31c26\ntestframework/schemas/backend-unit-observer-receipt.schema.v1.json\tsha256:3755d735a8121668dae7e4c3fddc188f6303f7e220b5329f4238364da530dfa0\ntestframework/policies/backend-unit-observer.v1.json\tsha256:bb74a36c2872b3448537b02611e1db093b6f55d52da716d86984735c20ffb59e\ntestframework/policies/backend-unit-phase150-08c2-subject.v1.json\tsha256:e70928cc5cd74e7c5668ea08fe6b94151a3c0c00143e28965e3731e970e8feac\ntestframework/policies/root-compose-testframework.v1.json\tsha256:892a6f8aaaf3e58b92c181a6a51af61f1258331bc5b7ce929f1e27608409d4d9\ntestframework/selftests/architecture/docker/test_root_compose_contract.py\tsha256:49e44930ffbf3f3f466980a245b5a7ca29c3efba23d0b4958ea9b32cc1b4b63b\ntestframework/selftests/architecture/observers/test_backend_unit_receipts.py\tsha256:db474464698e34dd344658a7f33c6caca7b3032046b2bfe6943595475aa0ea41\ntestframework/selftests/architecture/observers/test_backend_unit_receipts_review_contract.py\tsha256:00437fa730a32f547fac071c2b7b0c64e405fda348b95565674aa13caff296d6\ntestframework/selftests/architecture/observers/test_backend_unit_observer.py\tsha256:73d0a349cd6b61d1ca532e2329bbf9853a0a2bc07b048572a3ca53cec5033d73\ntestframework/selftests/architecture/observers/fixtures/backend_unit/valid/container-receipt.json\tsha256:5d5cbd57112b844b2270a4796e2df8da37bc8090c16b99f61d8a51645750fa3f\ntestframework/selftests/architecture/observers/fixtures/backend_unit/valid/final-receipt.json\tsha256:8752dbc0ff920a722b03f89f2058e68de6fda8fb5ee877d5b35e94e03b407280\ntestframework/selftests/architecture/observers/fixtures/backend_unit/valid/observer-receipt.json\tsha256:3876130a3d5cb1de8a7f1cf8b6aa817c77104b1318695db35428dd3e5b002b99\ntestframework/selftests/architecture/observers/fixtures/backend_unit/valid/package-plan.json\tsha256:a10096a55dd40c2628c092fe53a65998971e17a930aa24a084f2212be5f5cb20\ntestframework/selftests/architecture/observers/fixtures/backend_unit/valid/SEAL\tsha256:136826071d6b43c568b1e643d4c882cf3e49ec8cf3fd6443a6a059c050da4da9\ntestframework/selftests/architecture/observers/fixtures/backend_unit/invalid/bound-backend-image-observer-receipt.json\tsha256:c27c56c40fc4fd9aba8da6a62b6c4d321c8b7a59c7d0c36839138b2180819e3b\ntestframework/selftests/architecture/observers/fixtures/backend_unit/invalid/build-input-hash-observer-receipt.json\tsha256:c8d4f3243f625f393618e227e20dbd34bdeee8d74c9acc67ea8281c5617e924d\ntestframework/selftests/architecture/observers/fixtures/backend_unit/invalid/build-input-manifest-observer-receipt.json\tsha256:59dda0388d418441d2136618337318d4053df5eb01318d00d75132b147ed1792\ntestframework/selftests/architecture/observers/fixtures/backend_unit/invalid/count-package-plan.json\tsha256:4579122c357e79991d07e2e29b2b8730632b509af18320e902f482f20f81b1ee\ntestframework/selftests/architecture/observers/fixtur